{
  "schema_version": 1,
  "preset_id": "obstetrics-postpartum-care-associate-professor",
  "display_name": "産科・産後ケア研究プリセット（准教授向け）",
  "description": "看護学部看護学科の産科・産後ケア研究で使うためのKoeNoteドメインプリセットです。ASRコンテキスト、専門用語、施設種別、略語、薬剤名、推敲レビュー向けの補正メモリと表記ゆれを含みます。実患者情報、研究参加者の発話、個別大学名や未確認の固有施設名は含めません。",
  "domain": "obstetrics-postpartum-care-nursing-research",
  "asr_context": "この音声は、看護学、助産学、母性看護学、産科、周産期、産褥期、産後ケア、母子保健、母乳育児、育児支援、メンタルヘルス、地域包括ケア、行政保健、子育て世代包括支援センター、こども家庭センター、助産師外来、母乳外来、産後ケア事業、デイサービス型産後ケア、宿泊型産後ケア、アウトリーチ型産後ケア、訪問看護、保健師訪問に関する日本語の研究インタビュー、会議、授業、実習記録、研究ミーティングです。専門用語、制度名、施設種別、尺度名、薬剤名、略語を優先して認識してください。研究参加者や対象者の語りは過度に整えず、明らかなASR誤認識だけを最小限に修正してください。",
  "hotwords": [
    "産科",
    "産婦人科",
    "助産",
    "助産学",
    "母性看護学",
    "周産期",
    "妊娠期",
    "分娩期",
    "産褥期",
    "産後",
    "産後ケア",
    "産後ケア事業",
    "デイサービス型産後ケア",
    "宿泊型産後ケア",
    "アウトリーチ型産後ケア",
    "母子保健",
    "母子健康手帳",
    "母子健康包括支援センター",
    "子育て世代包括支援センター",
    "こども家庭センター",
    "地域包括ケア",
    "切れ目ない支援",
    "伴走型相談支援",
    "妊産婦",
    "褥婦",
    "初産婦",
    "経産婦",
    "新生児",
    "乳児",
    "低出生体重児",
    "早産児",
    "帝王切開",
    "経腟分娩",
    "無痛分娩",
    "分娩誘発",
    "陣痛促進",
    "産後出血",
    "弛緩出血",
    "会陰裂傷",
    "乳房トラブル",
    "乳房緊満",
    "乳腺炎",
    "母乳育児",
    "授乳支援",
    "搾乳",
    "混合栄養",
    "完全母乳",
    "人工乳",
    "エジンバラ産後うつ病質問票",
    "EPDS",
    "産後うつ",
    "マタニティブルーズ",
    "メンタルヘルス",
    "ボンディング",
    "母子相互作用",
    "愛着形成",
    "育児不安",
    "育児ストレス",
    "睡眠不足",
    "家族支援",
    "パートナー支援",
    "多職種連携",
    "助産師",
    "保健師",
    "看護師",
    "産婦人科医",
    "小児科医",
    "心理職",
    "管理栄養士",
    "社会福祉士",
    "医療ソーシャルワーカー",
    "助産院",
    "産後ケアセンター",
    "母子保健センター",
    "保健センター",
    "地域子育て支援拠点",
    "助産師外来",
    "母乳外来",
    "新生児訪問",
    "乳児家庭全戸訪問事業",
    "こんにちは赤ちゃん事業",
    "NICU",
    "GCU",
    "MFICU",
    "LDR",
    "PMS",
    "PICO",
    "RCT",
    "QOL",
    "WHO",
    "PHQ-9",
    "GAD-7",
    "K6",
    "オキシトシン",
    "メチルエルゴメトリン",
    "マレイン酸メチルエルゴメトリン",
    "トラネキサム酸",
    "硫酸マグネシウム",
    "ニフェジピン",
    "ラベタロール",
    "メチルドパ",
    "リトドリン",
    "アトシバン",
    "アセトアミノフェン",
    "ロキソプロフェン",
    "セファゾリン",
    "アンピシリン"
  ],
  "correction_memory": [
    {
      "wrong_text": "エディンバラ産後うつ病質問票",
      "correct_text": "エジンバラ産後うつ病質問票",
      "issue_type": "専門用語"
    },
    {
      "wrong_text": "エジンバラ産後鬱病質問票",
      "correct_text": "エジンバラ産後うつ病質問票",
      "issue_type": "表記ゆれ"
    },
    {
      "wrong_text": "産じょく期",
      "correct_text": "産褥期",
      "issue_type": "表記ゆれ"
    },
    {
      "wrong_text": "産褥き",
      "correct_text": "産褥期",
      "issue_type": "ASR誤認識"
    },
    {
      "wrong_text": "妊産婦さん",
      "correct_text": "妊産婦",
      "issue_type": "表記統一"
    },
    {
      "wrong_text": "じょく婦",
      "correct_text": "褥婦",
      "issue_type": "表記ゆれ"
    },
    {
      "wrong_text": "母子健康包括センター",
      "correct_text": "母子健康包括支援センター",
      "issue_type": "制度名"
    },
    {
      "wrong_text": "子育て世代包括センター",
      "correct_text": "子育て世代包括支援センター",
      "issue_type": "制度名"
    },
    {
      "wrong_text": "子ども家庭センター",
      "correct_text": "こども家庭センター",
      "issue_type": "制度名"
    },
    {
      "wrong_text": "アウトリーチ産後ケア",
      "correct_text": "アウトリーチ型産後ケア",
      "issue_type": "表記統一"
    },
    {
      "wrong_text": "デイケア型産後ケア",
      "correct_text": "デイサービス型産後ケア",
      "issue_type": "表記統一"
    },
    {
      "wrong_text": "宿泊産後ケア",
      "correct_text": "宿泊型産後ケア",
      "issue_type": "表記統一"
    },
    {
      "wrong_text": "母乳外来",
      "correct_text": "母乳外来",
      "issue_type": "専門用語"
    },
    {
      "wrong_text": "乳腺炎症",
      "correct_text": "乳腺炎",
      "issue_type": "ASR誤認識"
    },
    {
      "wrong_text": "乳房緊満感",
      "correct_text": "乳房緊満",
      "issue_type": "表記統一"
    },
    {
      "wrong_text": "マタニティーブルーズ",
      "correct_text": "マタニティブルーズ",
      "issue_type": "表記統一"
    },
    {
      "wrong_text": "ボンディング障害",
      "correct_text": "ボンディング",
      "issue_type": "表記統一"
    },
    {
      "wrong_text": "愛着形成支援",
      "correct_text": "愛着形成",
      "issue_type": "表記統一"
    },
    {
      "wrong_text": "切れ目のない支援",
      "correct_text": "切れ目ない支援",
      "issue_type": "表記統一"
    },
    {
      "wrong_text": "伴走型支援",
      "correct_text": "伴走型相談支援",
      "issue_type": "制度名"
    },
    {
      "wrong_text": "多職種連携ケア",
      "correct_text": "多職種連携",
      "issue_type": "表記統一"
    },
    {
      "wrong_text": "ニキュー",
      "correct_text": "NICU",
      "issue_type": "略語"
    },
    {
      "wrong_text": "ジーシーユー",
      "correct_text": "GCU",
      "issue_type": "略語"
    },
    {
      "wrong_text": "エムエフアイシーユー",
      "correct_text": "MFICU",
      "issue_type": "略語"
    },
    {
      "wrong_text": "エルディーアール",
      "correct_text": "LDR",
      "issue_type": "略語"
    },
    {
      "wrong_text": "ピーエイチキューナイン",
      "correct_text": "PHQ-9",
      "issue_type": "略語"
    },
    {
      "wrong_text": "ジーエーディーセブン",
      "correct_text": "GAD-7",
      "issue_type": "略語"
    },
    {
      "wrong_text": "ケーシックス",
      "correct_text": "K6",
      "issue_type": "略語"
    },
    {
      "wrong_text": "オキシトシン点滴",
      "correct_text": "オキシトシン",
      "issue_type": "薬剤名"
    },
    {
      "wrong_text": "メチルエルゴメトリンマレイン酸",
      "correct_text": "マレイン酸メチルエルゴメトリン",
      "issue_type": "薬剤名"
    },
    {
      "wrong_text": "トラネキサムさん",
      "correct_text": "トラネキサム酸",
      "issue_type": "薬剤名"
    },
    {
      "wrong_text": "硫酸マグネシューム",
      "correct_text": "硫酸マグネシウム",
      "issue_type": "薬剤名"
    },
    {
      "wrong_text": "ラベタロール",
      "correct_text": "ラベタロール",
      "issue_type": "薬剤名"
    },
    {
      "wrong_text": "アセトアミノフェン",
      "correct_text": "アセトアミノフェン",
      "issue_type": "薬剤名"
    },
    {
      "wrong_text": "ロキソプロフェン",
      "correct_text": "ロキソプロフェン",
      "issue_type": "薬剤名"
    },
    {
      "wrong_text": "セファゾリン",
      "correct_text": "セファゾリン",
      "issue_type": "薬剤名"
    }
  ],
  "review_guidelines": [
    "産科・産後ケア・母性看護学の専門用語は一般語へ言い換えず、明らかなASR誤認識または表記ゆれだけを最小修正してください。",
    "研究参加者や対象者の語りは、発話らしさを残してください。意味が通る発話を過度に整文しないでください。",
    "医学的判断、診断、処方、ケア評価を新たに追加しないでください。音声認識の誤りとして説明できる箇所だけ候補にしてください。",
    "制度名、施設種別、尺度名、略語、薬剤名は、文脈上明らかな場合に限って正式表記へ寄せてください。",
    "EPDS、PHQ-9、GAD-7、K6、NICU、GCU、MFICU、LDRなどの略語は、ひらがな・カタカナに展開せず英字表記を優先してください。",
    "個人名、大学名、病院名、自治体名など、音声内で確実に聞き取れない固有名詞は推測で補完しないでください。"
  ]
}
