{
  "schema_version": 1,
  "preset_id": "obstetrics-postpartum-care",
  "display_name": "産科・産後ケア研究プリセット",
  "description": "産科、助産、産後ケア、母子保健領域の一般用語をASR補助と推敲レビューに使うためのサンプルです。実患者データや研究参加者の発話は含めないでください。",
  "domain": "obstetrics-postpartum-care",
  "asr_context": "産科、助産、産後ケア、母子保健、母乳育児、育児支援、産褥期、地域包括ケアに関する日本語インタビューまたは研究ミーティングの音声です。専門用語、制度名、ケア内容、研究テーマ名を優先して認識してください。",
  "hotwords": [
    "産科",
    "助産",
    "産後ケア",
    "産褥期",
    "母子保健",
    "母乳育児",
    "育児支援",
    "周産期",
    "メンタルヘルス",
    "エジンバラ産後うつ病質問票",
    "EPDS",
    "地域包括ケア",
    "産後うつ",
    "新生児",
    "乳児",
    "授乳",
    "保健師",
    "助産師",
    "多職種連携"
  ],
  "correction_memory": [
    {
      "wrong_text": "エディンバラ産後うつ病質問票",
      "correct_text": "エジンバラ産後うつ病質問票",
      "issue_type": "専門用語"
    },
    {
      "wrong_text": "産じょく期",
      "correct_text": "産褥期",
      "issue_type": "表記ゆれ"
    }
  ],
  "speaker_aliases": [
    {
      "speaker_id": "Speaker_0",
      "display_name": "聞き手"
    },
    {
      "speaker_id": "Speaker_1",
      "display_name": "参加者"
    }
  ],
  "review_guidelines": [
    "産科・産後ケア領域の専門用語は一般語へ言い換えず、表記ゆれのみ最小修正してください。",
    "研究参加者の発話らしさが残る場合は、過度に整文しないでください。",
    "医学的判断や診断を追加せず、ASR誤認識として説明できる箇所だけ候補にしてください。"
  ]
}
